{
  "schema_version": "1.0.0",
  "document_type": "meta",
  "source": "melee",
  "product": "tabletop-major-events",
  "event_id": "434455",
  "format": "modern",
  "event_structure": "mixed",
  "event": {
    "name": "Pro Tour Magic: The Gathering | Marvel Super Heroes",
    "series": "pro_tour",
    "date": {
      "end": "2026-07-19",
      "start": "2026-07-17"
    },
    "source_url": "https://melee.gg/Tournament/View/434455"
  },
  "input": {
    "event_path": "data/modern/melee/events/434455.json",
    "event_sha256": "0b4296a9573a4facf4cfde1ce98569156f78fde6f5d2a1d3d662b54e2889e710",
    "event_schema_version": "2.2.0",
    "classification_path": "data/modern/melee/classifications/434455.json",
    "classification_sha256": "653b871bcfa54980bd9114cc962f46be92633d5667558cc561fbc23ffb7e129b",
    "classification_schema_version": "1.1.0",
    "opportunity_path": "data/modern/melee/opportunities/434455.json",
    "opportunity_sha256": "7d1f775b7448fb078c1fcfd0daeda5dc29ff227de8903f6238e1928a62acf708",
    "opportunity_schema_version": "1.1.0",
    "taxonomy_path": "my_archetypes/modern.yaml",
    "taxonomy_sha256": "cbafde2bb8d7784a7ccb487813f5ec355e0694629fcea902e9d12d719c845b5d",
    "taxonomy_schema_version": "1.1.0"
  },
  "scope_order": [
    "day1",
    "day2",
    "all_constructed"
  ],
  "default_scope": "all_constructed",
  "quality": {
    "status": "warning",
    "blocking": false,
    "issue_codes": [
      "disqualified_participant_matches_excluded",
      "mixed_event_day2_selection_bias"
    ]
  },
  "outputs": {
    "overview": {
      "path": "overview.json",
      "schema_version": "1.1.0",
      "bytes": 707234,
      "sha256": "6e6288005b055bee8a9a55fb1f68bc5fd6a00873f63d9c19cc309f64dbc81496"
    },
    "decks": {
      "path": "decks.json",
      "schema_version": "1.1.0",
      "bytes": 2641937,
      "sha256": "5c5def50130a13b340dde625b563de8bfb39b50c10ea1d91b08bf27236783938"
    },
    "matchup": {
      "path": "matchup.json",
      "schema_version": "1.0.0",
      "bytes": 6033136,
      "sha256": "c77d5fcf539211945ae9aece4c00e6cf8ad95718320806c3c3d722617741ef52"
    },
    "quality": {
      "path": "quality.json",
      "schema_version": "1.1.0",
      "bytes": 2956,
      "sha256": "286ecc82ae6e5b702b752742cec4642d199c1da3af815abccd62302a67379fa5"
    }
  }
}
